{
  "schemaVersion": 1,
  "phase": {
    "id": "P6",
    "name": "Post-release features"
  },
  "activeTask": {
    "id": "FEAT-022",
    "title": "Add note tags",
    "status": "ready",
    "objective": "Allow notes to have local tags that can be edited, displayed, searched, filtered, and preserved through validated backup and restore.",
    "requiredDocs": [
      "docs/WORKFLOW.md",
      "docs/ARCHITECTURE.md",
      "docs/DESIGN.md",
      "docs/PRODUCT.md",
      "docs/ROADMAP.md"
    ],
    "scope": [
      ".project/**",
      "docs/ARCHITECTURE.md",
      "docs/PRODUCT.md",
      "entrypoints/background.ts",
      "entrypoints/sidepanel/**",
      "src/app/**",
      "src/browser/**",
      "src/components/**",
      "src/db/**",
      "src/features/**",
      "src/styles/**",
      "src/test/**",
      "tests/**",
      "scripts/**",
      "package.json"
    ],
    "checks": [
      "powershell -ExecutionPolicy Bypass -File scripts/run-pnpm.ps1 run lint",
      "powershell -ExecutionPolicy Bypass -File scripts/run-pnpm.ps1 run typecheck",
      "powershell -ExecutionPolicy Bypass -File scripts/run-pnpm.ps1 run test",
      "powershell -ExecutionPolicy Bypass -File scripts/run-pnpm.ps1 run build",
      "powershell -ExecutionPolicy Bypass -File scripts/run-pnpm.ps1 run test:e2e",
      "powershell -ExecutionPolicy Bypass -File scripts/run-pnpm.ps1 run zip",
      "powershell -ExecutionPolicy Bypass -File scripts/verify-release.ps1"
    ],
    "commitMessage": "feat: add note tags",
    "blockedReason": null
  },
  "lastCompletedTask": {
    "id": "FEAT-022",
    "title": "Add note tags",
    "completedAt": "2026-07-19T14:04:38+07:00",
    "commit": "33051fe"
  },
  "nextTasks": [],
  "updatedAt": "2026-07-19T14:04:38+07:00"
}
